Indicator.Name,Indicator.Code
Individuals using the Internet (% of population),IT.NET.USER.ZS
"Industrial design applications, nonresident, by count",IP.IDS.NRCT
"Industrial design applications, resident, by count",IP.IDS.RSCT
"Industry (including construction), value added (% of GDP)",NV.IND.TOTL.ZS
"Industry (including construction), value added (annual % growth)",NV.IND.TOTL.KD.ZG
"Industry (including construction), value added (constant 2010 US$)",NV.IND.TOTL.KD
"Industry (including construction), value added (constant LCU)",NV.IND.TOTL.KN
"Industry (including construction), value added (current LCU)",NV.IND.TOTL.CN
"Industry (including construction), value added (current US$)",NV.IND.TOTL.CD
"Industry (including construction), value added per worker (constant 2010 US$)",NV.IND.EMPL.KD
"Inflation, consumer prices (annual %)",FP.CPI.TOTL.ZG
"Inflation, GDP deflator (annual %)",NY.GDP.DEFL.KD.ZG
"Inflation, GDP deflator: linked series (annual %)",NY.GDP.DEFL.KD.ZG.AD
Informal employment (% of total non-agricultural employment),SL.ISV.IFRM.ZS
"Informal employment, female (% of total non-agricultural employment)",SL.ISV.IFRM.FE.ZS
"Informal employment, male (% of total non-agricultural employment)",SL.ISV.IFRM.MA.ZS
Informal payments to public officials (% of firms),IC.FRM.CORR.ZS
Insurance and financial services (% of commercial service exports),TX.VAL.INSF.ZS.WT
Insurance and financial services (% of commercial service imports),TM.VAL.INSF.ZS.WT
"Insurance and financial services (% of service exports, BoP)",BX.GSR.INSF.ZS
"Insurance and financial services (% of service imports, BoP)",BM.GSR.INSF.ZS
"Intentional homicides (per 100,000 people)",VC.IHR.PSRC.P5
"Intentional homicides, female (per 100,000 female)",VC.IHR.PSRC.FE.P5
"Intentional homicides, male (per 100,000 male)",VC.IHR.PSRC.MA.P5
"Interest arrears, long-term DOD (US$)",DT.IXA.DPPG.CD
"Interest arrears, official creditors (current US$)",DT.IXA.OFFT.CD
"Interest arrears, private creditors (current US$)",DT.IXA.PRVT.CD
Interest forgiven (current US$),DT.IXF.DPPG.CD
Interest payments (% of expense),GC.XPN.INTP.ZS
Interest payments (% of revenue),GC.XPN.INTP.RV.ZS
Interest payments (current LCU),GC.XPN.INTP.CN
"Interest payments on external debt (% of exports of goods, services and primary income)",DT.INT.DECT.EX.ZS
Interest payments on external debt (% of GNI),DT.INT.DECT.GN.ZS
"Interest payments on external debt, long-term (INT, current US$)",DT.INT.DLXF.CD
"Interest payments on external debt, private nonguaranteed (PNG) (INT, current US$)",DT.INT.DPNG.CD
"Interest payments on external debt, public and publicly guaranteed (PPG) (INT, current US$)",DT.INT.DPPG.CD
"Interest payments on external debt, short-term (INT, current US$)",DT.INT.DSTC.CD
"Interest payments on external debt, total (INT, current US$)",DT.INT.DECT.CD
"Interest rate spread (lending rate minus deposit rate, %)",FR.INR.LNDP
Interest rescheduled (capitalized) (current US$),DT.IXR.DPPG.CD
"Interest rescheduled, official (current US$)",DT.IXR.OFFT.CD
"Interest rescheduled, private (current US$)",DT.IXR.PRVT.CD
"Internally displaced persons, new displacement associated with conflict and violence (number of cases)",VC.IDP.NWCV
"Internally displaced persons, new displacement associated with disasters (number of cases)",VC.IDP.NWDS
"Internally displaced persons, total displaced by conflict and violence (number of people)",VC.IDP.TOCV
International migrant stock (% of population),SM.POP.TOTL.ZS
"International migrant stock, total",SM.POP.TOTL
"International tourism, expenditures (% of total imports)",ST.INT.XPND.MP.ZS
"International tourism, expenditures (current US$)",ST.INT.XPND.CD
"International tourism, expenditures for passenger transport items (current US$)",ST.INT.TRNX.CD
"International tourism, expenditures for travel items (current US$)",ST.INT.TVLX.CD
"International tourism, number of arrivals",ST.INT.ARVL
"International tourism, number of departures",ST.INT.DPRT
"International tourism, receipts (% of total exports)",ST.INT.RCPT.XP.ZS
"International tourism, receipts (current US$)",ST.INT.RCPT.CD
"International tourism, receipts for passenger transport items (current US$)",ST.INT.TRNR.CD
"International tourism, receipts for travel items (current US$)",ST.INT.TVLR.CD
Investment in energy with private participation (current US$),IE.PPI.ENGY.CD
Investment in ICT with private participation (current US$),IE.PPI.ICTI.CD
Investment in transport with private participation (current US$),IE.PPI.TRAN.CD
Investment in water and sanitation with private participation (current US$),IE.PPI.WATR.CD
"Labor force participation rate for ages 15-24, female (%) (modeled ILO estimate)",SL.TLF.ACTI.1524.FE.ZS
"Labor force participation rate for ages 15-24, female (%) (national estimate)",SL.TLF.ACTI.1524.FE.NE.ZS
"Labor force participation rate for ages 15-24, male (%) (modeled ILO estimate)",SL.TLF.ACTI.1524.MA.ZS
"Labor force participation rate for ages 15-24, male (%) (national estimate)",SL.TLF.ACTI.1524.MA.NE.ZS
"Labor force participation rate for ages 15-24, total (%) (modeled ILO estimate)",SL.TLF.ACTI.1524.ZS
"Labor force participation rate for ages 15-24, total (%) (national estimate)",SL.TLF.ACTI.1524.NE.ZS
"Labor force participation rate, female (% of female population ages 15+) (modeled ILO estimate)",SL.TLF.CACT.FE.ZS
"Labor force participation rate, female (% of female population ages 15+) (national estimate)",SL.TLF.CACT.FE.NE.ZS
"Labor force participation rate, female (% of female population ages 15-64) (modeled ILO estimate)",SL.TLF.ACTI.FE.ZS
"Labor force participation rate, male (% of male population ages 15+) (modeled ILO estimate)",SL.TLF.CACT.MA.ZS
"Labor force participation rate, male (% of male population ages 15+) (national estimate)",SL.TLF.CACT.MA.NE.ZS
"Labor force participation rate, male (% of male population ages 15-64) (modeled ILO estimate)",SL.TLF.ACTI.MA.ZS
"Labor force participation rate, total (% of total population ages 15+) (modeled ILO estimate)",SL.TLF.CACT.ZS
"Labor force participation rate, total (% of total population ages 15+) (national estimate)",SL.TLF.CACT.NE.ZS
"Labor force participation rate, total (% of total population ages 15-64) (modeled ILO estimate)",SL.TLF.ACTI.ZS
Labor force with advanced education (% of total working-age population with advanced education),SL.TLF.ADVN.ZS
"Labor force with advanced education, female (% of female working-age population with advanced education)",SL.TLF.ADVN.FE.ZS
"Labor force with advanced education, male (% of male working-age population with advanced education)",SL.TLF.ADVN.MA.ZS
Labor force with basic education (% of total working-age population with basic education),SL.TLF.BASC.ZS
"Labor force with basic education, female (% of female working-age population with basic education)",SL.TLF.BASC.FE.ZS
"Labor force with basic education, male (% of male working-age population with basic education)",SL.TLF.BASC.MA.ZS
Labor force with intermediate education (% of total working-age population with intermediate education),SL.TLF.INTM.ZS
"Labor force with intermediate education, female (% of female working-age population with intermediate education)",SL.TLF.INTM.FE.ZS
"Labor force with intermediate education, male (% of male working-age population with intermediate education)",SL.TLF.INTM.MA.ZS
"Labor force, female (% of total labor force)",SL.TLF.TOTL.FE.ZS
"Labor force, total",SL.TLF.TOTL.IN
Labor tax and contributions (% of commercial profits),IC.TAX.LABR.CP.ZS
Land area (sq. km),AG.LND.TOTL.K2
Land area where elevation is below 5 meters (% of total land area),AG.LND.EL5M.ZS
Land under cereal production (hectares),AG.LND.CREL.HA
Law mandates equal remuneration for females and males for work of equal value (1=yes; 0=no),SG.LAW.EQRM.WK
Law mandates nondiscrimination based on gender in hiring (1=yes; 0=no),SG.LAW.NODC.HR
Law mandates paid or unpaid maternity leave (1=yes; 0=no),SG.LAW.LEVE.PU
Law prohibits or invalidates child or early marriage (1=yes; 0=no),SG.LAW.CHMR
"Lead time to export, median case (days)",LP.EXP.DURS.MD
"Lead time to import, median case (days)",LP.IMP.DURS.MD
Legislation exists on domestic violence (1=yes; 0=no),SG.LEG.DVAW
Lending interest rate (%),FR.INR.LEND
Level of water stress: freshwater withdrawal as a proportion of available freshwater resources,ER.H2O.FWST.ZS
"Life expectancy at birth, female (years)",SP.DYN.LE00.FE.IN
"Life expectancy at birth, male (years)",SP.DYN.LE00.MA.IN
"Life expectancy at birth, total (years)",SP.DYN.LE00.IN
Lifetime risk of maternal death (%),SH.MMR.RISK.ZS
Lifetime risk of maternal death (1 in: rate varies by country),SH.MMR.RISK
Liner shipping connectivity index (maximum value in 2004 = 100),IS.SHP.GCNW.XQ
"Listed domestic companies, total",CM.MKT.LDOM.NO
"Literacy rate, adult female (% of females ages 15 and above)",SE.ADT.LITR.FE.ZS
"Literacy rate, adult male (% of males ages 15 and above)",SE.ADT.LITR.MA.ZS
"Literacy rate, adult total (% of people ages 15 and above)",SE.ADT.LITR.ZS
"Literacy rate, youth (ages 15-24), gender parity index (GPI)",SE.ADT.1524.LT.FM.ZS
"Literacy rate, youth female (% of females ages 15-24)",SE.ADT.1524.LT.FE.ZS
"Literacy rate, youth male (% of males ages 15-24)",SE.ADT.1524.LT.MA.ZS
"Literacy rate, youth total (% of people ages 15-24)",SE.ADT.1524.LT.ZS
Livestock production index (2004-2006 = 100),AG.PRD.LVSK.XD
Logistics performance index: Ability to track and trace consignments (1=low to 5=high),LP.LPI.TRAC.XQ
Logistics performance index: Competence and quality of logistics services (1=low to 5=high),LP.LPI.LOGS.XQ
Logistics performance index: Ease of arranging competitively priced shipments (1=low to 5=high),LP.LPI.ITRN.XQ
Logistics performance index: Efficiency of customs clearance process (1=low to 5=high),LP.LPI.CUST.XQ
Logistics performance index: Frequency with which shipments reach consignee within scheduled or expected time (1=low to 5=high),LP.LPI.TIME.XQ
Logistics performance index: Overall (1=low to 5=high),LP.LPI.OVRL.XQ
Logistics performance index: Quality of trade and transport-related infrastructure (1=low to 5=high),LP.LPI.INFR.XQ
Losses due to theft and vandalism (% of annual sales of affected firms),IC.FRM.CRIM.ZS
Low-birthweight babies (% of births),SH.STA.BRTW.ZS
"Lower secondary completion rate, female (% of relevant age group)",SE.SEC.CMPT.LO.FE.ZS
"Lower secondary completion rate, male (% of relevant age group)",SE.SEC.CMPT.LO.MA.ZS
"Lower secondary completion rate, total (% of relevant age group)",SE.SEC.CMPT.LO.ZS
Lower secondary school starting age (years),SE.SEC.AGES
Machinery and transport equipment (% of value added in manufacturing),NV.MNF.MTRN.ZS.UN
"Mammal species, threatened",EN.MAM.THRD.NO
Manufactures exports (% of merchandise exports),TX.VAL.MANF.ZS.UN
Manufactures imports (% of merchandise imports),TM.VAL.MANF.ZS.UN
"Manufacturing, value added (% of GDP)",NV.IND.MANF.ZS
"Manufacturing, value added (annual % growth)",NV.IND.MANF.KD.ZG
"Manufacturing, value added (constant 2010 US$)",NV.IND.MANF.KD
"Manufacturing, value added (constant LCU)",NV.IND.MANF.KN
"Manufacturing, value added (current LCU)",NV.IND.MANF.CN
"Manufacturing, value added (current US$)",NV.IND.MANF.CD
Marine protected areas (% of territorial waters),ER.MRN.PTMR.ZS
Market capitalization of listed domestic companies (% of GDP),CM.MKT.LCAP.GD.ZS
Market capitalization of listed domestic companies (current US$),CM.MKT.LCAP.CD
"Maternal mortality ratio (modeled estimate, per 100,000 live births)",SH.STA.MMRT
"Maternal mortality ratio (national estimate, per 100,000 live births)",SH.STA.MMRT.NE
Medium and high-tech exports (% manufactured exports),TX.MNF.TECH.ZS.UN
Medium and high-tech Industry (including construction) (% manufacturing value added),NV.MNF.TECH.ZS.UN
Merchandise exports (current US$),TX.VAL.MRCH.CD.WT
Merchandise exports by the reporting economy (current US$),TX.VAL.MRCH.WL.CD
"Merchandise exports by the reporting economy, residual (% of total merchandise exports)",TX.VAL.MRCH.RS.ZS
Merchandise exports to economies in the Arab World (% of total merchandise exports),TX.VAL.MRCH.AL.ZS
Merchandise exports to high-income economies (% of total merchandise exports),TX.VAL.MRCH.HI.ZS
Merchandise exports to low- and middle-income economies in East Asia & Pacific (% of total merchandise exports),TX.VAL.MRCH.R1.ZS
Merchandise exports to low- and middle-income economies in Europe & Central Asia (% of total merchandise exports),TX.VAL.MRCH.R2.ZS
Merchandise exports to low- and middle-income economies in Latin America & the Caribbean (% of total merchandise exports),TX.VAL.MRCH.R3.ZS
Merchandise exports to low- and middle-income economies in Middle East & North Africa (% of total merchandise exports),TX.VAL.MRCH.R4.ZS
Merchandise exports to low- and middle-income economies in South Asia (% of total merchandise exports),TX.VAL.MRCH.R5.ZS
Merchandise exports to low- and middle-income economies in Sub-Saharan Africa (% of total merchandise exports),TX.VAL.MRCH.R6.ZS
Merchandise exports to low- and middle-income economies outside region (% of total merchandise exports),TX.VAL.MRCH.OR.ZS
Merchandise exports to low- and middle-income economies within region (% of total merchandise exports),TX.VAL.MRCH.WR.ZS
Merchandise imports (current US$),TM.VAL.MRCH.CD.WT
Merchandise imports by the reporting economy (current US$),TM.VAL.MRCH.WL.CD
"Merchandise imports by the reporting economy, residual (% of total merchandise imports)",TM.VAL.MRCH.RS.ZS
Merchandise imports from economies in the Arab World (% of total merchandise imports),TM.VAL.MRCH.AL.ZS
Merchandise imports from high-income economies (% of total merchandise imports),TM.VAL.MRCH.HI.ZS
Merchandise imports from low- and middle-income economies in East Asia & Pacific (% of total merchandise imports),TM.VAL.MRCH.R1.ZS
Merchandise imports from low- and middle-income economies in Europe & Central Asia (% of total merchandise imports),TM.VAL.MRCH.R2.ZS
Merchandise imports from low- and middle-income economies in Latin America & the Caribbean (% of total merchandise imports),TM.VAL.MRCH.R3.ZS
Merchandise imports from low- and middle-income economies in Middle East & North Africa (% of total merchandise imports),TM.VAL.MRCH.R4.ZS
Merchandise imports from low- and middle-income economies in South Asia (% of total merchandise imports),TM.VAL.MRCH.R5.ZS
Merchandise imports from low- and middle-income economies in Sub-Saharan Africa (% of total merchandise imports),TM.VAL.MRCH.R6.ZS
Merchandise imports from low- and middle-income economies outside region (% of total merchandise imports),TM.VAL.MRCH.OR.ZS
Merchandise imports from low- and middle-income economies within region (% of total merchandise imports),TM.VAL.MRCH.WR.ZS
Merchandise trade (% of GDP),TG.VAL.TOTL.GD.ZS
Methane emissions (% change from 1990),EN.ATM.METH.ZG
Methane emissions (kt of CO2 equivalent),EN.ATM.METH.KT.CE
Methane emissions in energy sector (thousand metric tons of CO2 equivalent),EN.ATM.METH.EG.KT.CE
Methodology assessment of statistical capacity (scale 0 - 100),IQ.SCI.MTHD
Military expenditure (% of GDP),MS.MIL.XPND.GD.ZS
Military expenditure (% of general government expenditure),MS.MIL.XPND.ZS
Military expenditure (current LCU),MS.MIL.XPND.CN
Military expenditure (current USD),MS.MIL.XPND.CD
Mineral rents (% of GDP),NY.GDP.MINR.RT.ZS
Mobile cellular subscriptions,IT.CEL.SETS
Mobile cellular subscriptions (per 100 people),IT.CEL.SETS.P2
"Mortality caused by road traffic injury (per 100,000 people)",SH.STA.TRAF.P5
"Mortality from CVD, cancer, diabetes or CRD between exact ages 30 and 70 (%)",SH.DYN.NCOM.ZS
"Mortality from CVD, cancer, diabetes or CRD between exact ages 30 and 70, female (%)",SH.DYN.NCOM.FE.ZS
"Mortality from CVD, cancer, diabetes or CRD between exact ages 30 and 70, male (%)",SH.DYN.NCOM.MA.ZS
"Mortality rate attributed to household and ambient air pollution, age-standardized (per 100,000 population)",SH.STA.AIRP.P5
"Mortality rate attributed to household and ambient air pollution, age-standardized, female (per 100,000 female population)",SH.STA.AIRP.FE.P5
"Mortality rate attributed to household and ambient air pollution, age-standardized, male (per 100,000 male population)",SH.STA.AIRP.MA.P5
"Mortality rate attributed to unintentional poisoning (per 100,000 population)",SH.STA.POIS.P5
"Mortality rate attributed to unintentional poisoning, female (per 100,000 female population)",SH.STA.POIS.P5.FE
"Mortality rate attributed to unintentional poisoning, male (per 100,000 male population)",SH.STA.POIS.P5.MA
"Mortality rate attributed to unsafe water, unsafe sanitation and lack of hygiene (per 100,000 population)",SH.STA.WASH.P5
"Mortality rate, adult, female (per 1,000 female adults)",SP.DYN.AMRT.FE
"Mortality rate, adult, male (per 1,000 male adults)",SP.DYN.AMRT.MA
"Mortality rate, infant (per 1,000 live births)",SP.DYN.IMRT.IN
"Mortality rate, infant, female (per 1,000 live births)",SP.DYN.IMRT.FE.IN
"Mortality rate, infant, male (per 1,000 live births)",SP.DYN.IMRT.MA.IN
"Mortality rate, neonatal (per 1,000 live births)",SH.DYN.NMRT
"Mortality rate, under-5 (per 1,000 live births)",SH.DYN.MORT
"Mortality rate, under-5, female (per 1,000 live births)",SH.DYN.MORT.FE
"Mortality rate, under-5, male (per 1,000 live births)",SH.DYN.MORT.MA
Mothers are guaranteed an equivalent position after maternity leave (1=yes; 0=no),SG.MMR.LEVE.EP
Multilateral debt (% of total external debt),DT.DOD.MLAT.ZS
Multilateral debt service (% of public and publicly guaranteed debt service),DT.TDS.MLAT.PG.ZS
"Multilateral debt service (TDS, current US$)",DT.TDS.MLAT.CD
Natural gas rents (% of GDP),NY.GDP.NGAS.RT.ZS
Net acquisition of financial assets (% of GDP),GC.AST.TOTL.GD.ZS
Net acquisition of financial assets (current LCU),GC.AST.TOTL.CN
Net barter terms of trade index (2000 = 100),TT.PRI.MRCH.XD.WD
"Net bilateral aid flows from DAC donors, Australia (current US$)",DC.DAC.AUSL.CD
"Net bilateral aid flows from DAC donors, Austria (current US$)",DC.DAC.AUTL.CD
"Net bilateral aid flows from DAC donors, Belgium (current US$)",DC.DAC.BELL.CD
"Net bilateral aid flows from DAC donors, Canada (current US$)",DC.DAC.CANL.CD
"Net bilateral aid flows from DAC donors, Czech Republic (current US$)",DC.DAC.CZEL.CD
"Net bilateral aid flows from DAC donors, Denmark (current US$)",DC.DAC.DNKL.CD
"Net bilateral aid flows from DAC donors, European Union institutions (current US$)",DC.DAC.CECL.CD
"Net bilateral aid flows from DAC donors, Finland (current US$)",DC.DAC.FINL.CD
"Net bilateral aid flows from DAC donors, France (current US$)",DC.DAC.FRAL.CD
"Net bilateral aid flows from DAC donors, Germany (current US$)",DC.DAC.DEUL.CD
"Net bilateral aid flows from DAC donors, Greece (current US$)",DC.DAC.GRCL.CD
"Net bilateral aid flows from DAC donors, Iceland (current US$)",DC.DAC.ISLL.CD
"Net bilateral aid flows from DAC donors, Ireland (current US$)",DC.DAC.IRLL.CD
"Net bilateral aid flows from DAC donors, Italy (current US$)",DC.DAC.ITAL.CD
"Net bilateral aid flows from DAC donors, Japan (current US$)",DC.DAC.JPNL.CD
"Net bilateral aid flows from DAC donors, Korea, Rep. (current US$)",DC.DAC.KORL.CD
"Net bilateral aid flows from DAC donors, Luxembourg (current US$)",DC.DAC.LUXL.CD
"Net bilateral aid flows from DAC donors, Netherlands (current US$)",DC.DAC.NLDL.CD
"Net bilateral aid flows from DAC donors, New Zealand (current US$)",DC.DAC.NZLL.CD
"Net bilateral aid flows from DAC donors, Norway (current US$)",DC.DAC.NORL.CD
"Net bilateral aid flows from DAC donors, Poland (current US$)",DC.DAC.POLL.CD
"Net bilateral aid flows from DAC donors, Portugal (current US$)",DC.DAC.PRTL.CD
"Net bilateral aid flows from DAC donors, Slovak Republic (current US$)",DC.DAC.SVKL.CD
"Net bilateral aid flows from DAC donors, Slovenia (current US$)",DC.DAC.SVNL.CD
"Net bilateral aid flows from DAC donors, Spain (current US$)",DC.DAC.ESPL.CD
"Net bilateral aid flows from DAC donors, Sweden (current US$)",DC.DAC.SWEL.CD
"Net bilateral aid flows from DAC donors, Switzerland (current US$)",DC.DAC.CHEL.CD
"Net bilateral aid flows from DAC donors, Total (current US$)",DC.DAC.TOTL.CD
"Net bilateral aid flows from DAC donors, United Kingdom (current US$)",DC.DAC.GBRL.CD
"Net bilateral aid flows from DAC donors, United States (current US$)",DC.DAC.USAL.CD
"Net capital account (BoP, current US$)",BN.TRF.KOGT.CD
Net change in interest arrears (current US$),DT.IXA.DPPG.CD.CG
Net domestic credit (current LCU),FM.AST.DOMS.CN
"Net errors and omissions (BoP, current US$)",BN.KAC.EOMS.CD
"Net financial account (BoP, current US$)",BN.FIN.TOTL.CD
"Net financial flows, bilateral (NFL, current US$)",DT.NFL.BLAT.CD
"Net financial flows, IBRD (NFL, current US$)",DT.NFL.MIBR.CD
"Net financial flows, IDA (NFL, current US$)",DT.NFL.MIDA.CD
"Net financial flows, IMF concessional (NFL, current US$)",DT.NFL.IMFC.CD
"Net financial flows, IMF nonconcessional (NFL, current US$)",DT.NFL.IMFN.CD
"Net financial flows, multilateral (NFL, current US$)",DT.NFL.MLAT.CD
"Net financial flows, others (NFL, current US$)",DT.NFL.MOTH.CD
"Net financial flows, RDB concessional (NFL, current US$)",DT.NFL.RDBC.CD
"Net financial flows, RDB nonconcessional (NFL, current US$)",DT.NFL.RDBN.CD
"Net flows on external debt, long-term (NFL, current US$)",DT.NFL.DLXF.CD
"Net flows on external debt, private nonguaranteed (PNG) (NFL, current US$)",DT.NFL.DPNG.CD
"Net flows on external debt, public and publicly guaranteed (PPG) (NFL, current US$)",DT.NFL.DPPG.CD
"Net flows on external debt, short-term (NFL, current US$)",DT.NFL.DSTC.CD
"Net flows on external debt, total (NFL, current US$)",DT.NFL.DECT.CD
Net foreign assets (current LCU),FM.AST.NFRG.CN
"Net incurrence of liabilities, total (% of GDP)",GC.LBL.TOTL.GD.ZS
"Net incurrence of liabilities, total (current LCU)",GC.LBL.TOTL.CN
Net intake rate in grade 1 (% of official school-age population),SE.PRM.NINT.ZS
"Net intake rate in grade 1, female (% of official school-age population)",SE.PRM.NINT.FE.ZS
"Net intake rate in grade 1, male (% of official school-age population)",SE.PRM.NINT.MA.ZS
Net investment in nonfinancial assets (% of GDP),GC.NFN.TOTL.GD.ZS
Net investment in nonfinancial assets (current LCU),GC.NFN.TOTL.CN
Net lending (+) / net borrowing (-) (% of GDP),GC.NLD.TOTL.GD.ZS
Net lending (+) / net borrowing (-) (current LCU),GC.NLD.TOTL.CN
Net migration,SM.POP.NETM
Net ODA provided to the least developed countries (% of GNI),DC.ODA.TLDC.GN.ZS
"Net ODA provided, to the least developed countries (current US$)",DC.ODA.TLDC.CD
"Net ODA provided, total (% of GNI)",DC.ODA.TOTL.GN.ZS
"Net ODA provided, total (constant 2015 US$)",DC.ODA.TOTL.KD
"Net ODA provided, total (current US$)",DC.ODA.TOTL.CD
Net ODA received (% of central government expense),DT.ODA.ODAT.XP.ZS
Net ODA received (% of GNI),DT.ODA.ODAT.GN.ZS
Net ODA received (% of gross capital formation),DT.ODA.ODAT.GI.ZS
"Net ODA received (% of imports of goods, services and primary income)",DT.ODA.ODAT.MP.ZS
Net ODA received per capita (current US$),DT.ODA.ODAT.PC.ZS
Net official aid received (constant 2015 US$),DT.ODA.OATL.KD
Net official aid received (current US$),DT.ODA.OATL.CD
Net official development assistance and official aid received (constant 2015 US$),DT.ODA.ALLD.KD
Net official development assistance and official aid received (current US$),DT.ODA.ALLD.CD
Net official development assistance received (constant 2015 US$),DT.ODA.ODAT.KD
Net official development assistance received (current US$),DT.ODA.ODAT.CD
"Net official flows from UN agencies, FAO (current US$)",DT.NFL.FAOG.CD
"Net official flows from UN agencies, IAEA (current US$)",DT.NFL.IAEA.CD
"Net official flows from UN agencies, IFAD (current US$)",DT.NFL.IFAD.CD
"Net official flows from UN agencies, ILO (current US$)",DT.NFL.ILOG.CD
"Net official flows from UN agencies, UNAIDS (current US$)",DT.NFL.UNAI.CD
"Net official flows from UN agencies, UNDP (current US$)",DT.NFL.UNDP.CD
"Net official flows from UN agencies, UNECE (current US$)",DT.NFL.UNEC.CD
"Net official flows from UN agencies, UNFPA (current US$)",DT.NFL.UNFP.CD
"Net official flows from UN agencies, UNHCR (current US$)",DT.NFL.UNCR.CD
"Net official flows from UN agencies, UNICEF (current US$)",DT.NFL.UNCF.CD
"Net official flows from UN agencies, UNPBF (current US$)",DT.NFL.UNPB.CD
"Net official flows from UN agencies, UNRWA (current US$)",DT.NFL.UNRW.CD
"Net official flows from UN agencies, UNTA (current US$)",DT.NFL.UNTA.CD
"Net official flows from UN agencies, UNWTO (current US$)",DT.NFL.UNWT.CD
"Net official flows from UN agencies, WFP (current US$)",DT.NFL.WFPG.CD
"Net official flows from UN agencies, WHO (current US$)",DT.NFL.WHOL.CD
"Net primary income (BoP, current US$)",BN.GSR.FCTY.CD
Net primary income (Net income from abroad) (constant LCU),NY.GSR.NFCY.KN
Net primary income (Net income from abroad) (current LCU),NY.GSR.NFCY.CN
Net primary income (Net income from abroad) (current US$),NY.GSR.NFCY.CD
"Net secondary income (BoP, current US$)",BN.TRF.CURR.CD
Net secondary income (Net current transfers from abroad) (constant LCU),NY.TRF.NCTR.KN
Net secondary income (Net current transfers from abroad) (current LCU),NY.TRF.NCTR.CN
Net secondary income (Net current transfers from abroad) (current US$),NY.TRF.NCTR.CD
"Net trade in goods (BoP, current US$)",BN.GSR.MRCH.CD
"Net trade in goods and services (BoP, current US$)",BN.GSR.GNFS.CD
"Net transfers on external debt, long-term (NTR, current US$)",DT.NTR.DLXF.CD
"Net transfers on external debt, private nonguaranteed (PNG) (NTR, current US$)",DT.NTR.DPNG.CD
"Net transfers on external debt, public and publicly guaranteed (PPG) (NTR, current US$)",DT.NTR.DPPG.CD
