Indicator.Name,Indicator.Code
"Net transfers on external debt, total (NTR, current US$)",DT.NTR.DECT.CD
"New business density (new registrations per 1,000 people ages 15-64)",IC.BUS.NDNS.ZS
New businesses registered (number),IC.BUS.NREG
Newborns protected against tetanus (%),SH.VAC.TTNS.ZS
Nitrous oxide emissions (% change from 1990),EN.ATM.NOXE.ZG
Nitrous oxide emissions (thousand metric tons of CO2 equivalent),EN.ATM.NOXE.KT.CE
Nitrous oxide emissions in energy sector (% of total),EN.ATM.NOXE.EG.ZS
Nitrous oxide emissions in energy sector (thousand metric tons of CO2 equivalent),EN.ATM.NOXE.EG.KT.CE
Nondiscrimination clause mentions gender in the constitution (1=yes; 0=no),SG.NOD.CONS
Nonpregnant and nonnursing women can do the same jobs as men (1=yes; 0=no),SG.JOB.NOPN.EQ
Number of deaths ages 5-14 years,SH.DTH.0514
Number of infant deaths,SH.DTH.IMRT
Number of maternal deaths,SH.MMR.DTHS
Number of neonatal deaths,SH.DTH.NMRT
Number of people pushed below the $1.90 ($ 2011 PPP) poverty line by out-of-pocket health care expenditure,SH.UHC.NOP1.TO
Number of people pushed below the $3.10 ($ 2011 PPP) poverty line by out-of-pocket health care expenditure,SH.UHC.NOP2.TO
Number of people spending more than 10% of household consumption or income on out-of-pocket health care expenditure,SH.UHC.OOPC.10.TO
Number of people spending more than 25% of household consumption or income on out-of-pocket health care expenditure,SH.UHC.OOPC.25.TO
"Number of surgical procedures (per 100,000 population)",SH.SGR.PROC.P5
Number of under-five deaths,SH.DTH.MORT
Number of visits or required meetings of affected firms with tax officials,IC.TAX.METG
"Nurses and midwives (per 1,000 people)",SH.MED.NUMW.P3
"Official exchange rate (LCU per US$, period average)",PA.NUS.FCRF
Oil rents (% of GDP),NY.GDP.PETR.RT.ZS
Ores and metals exports (% of merchandise exports),TX.VAL.MMTL.ZS.UN
Ores and metals imports (% of merchandise imports),TM.VAL.MMTL.ZS.UN
Other expense (% of expense),GC.XPN.OTHR.ZS
Other expense (current LCU),GC.XPN.OTHR.CN
Other greenhouse gas emissions (% change from 1990),EN.ATM.GHGO.ZG
"Other greenhouse gas emissions, HFC, PFC and SF6 (thousand metric tons of CO2 equivalent)",EN.ATM.GHGO.KT.CE
Other manufacturing (% of value added in manufacturing),NV.MNF.OTHR.ZS.UN
Other taxes (% of revenue),GC.TAX.OTHR.RV.ZS
Other taxes (current LCU),GC.TAX.OTHR.CN
Other taxes payable by businesses (% of commercial profits),IC.TAX.OTHR.CP.ZS
Out-of-pocket expenditure (% of current health expenditure),SH.XPD.OOPC.CH.ZS
Out-of-pocket expenditure per capita (current US$),SH.XPD.OOPC.PC.CD
"Out-of-pocket expenditure per capita, PPP (current international $)",SH.XPD.OOPC.PP.CD
"Over-age students, primary (% of enrollment)",SE.PRM.OENR.ZS
"Over-age students, primary, female (% of female enrollment)",SE.PRM.OENR.FE.ZS
"Over-age students, primary, male (% of male enrollment)",SE.PRM.OENR.MA.ZS
"Part time employment, female (% of total female employment)",SL.TLF.PART.FE.ZS
"Part time employment, male (% of total male employment)",SL.TLF.PART.MA.ZS
"Part time employment, total (% of total employment)",SL.TLF.PART.ZS
"Patent applications, nonresidents",IP.PAT.NRES
"Patent applications, residents",IP.PAT.RESD
People practicing open defecation (% of population),SH.STA.ODFC.ZS
"People practicing open defecation, rural (% of rural population)",SH.STA.ODFC.RU.ZS
"People practicing open defecation, urban (% of urban population)",SH.STA.ODFC.UR.ZS
People using at least basic drinking water services (% of population),SH.H2O.BASW.ZS
"People using at least basic drinking water services, rural (% of rural population)",SH.H2O.BASW.RU.ZS
"People using at least basic drinking water services, urban (% of urban population)",SH.H2O.BASW.UR.ZS
People using at least basic sanitation services (% of population),SH.STA.BASS.ZS
"People using at least basic sanitation services, rural (% of rural population)",SH.STA.BASS.RU.ZS
"People using at least basic sanitation services, urban (% of urban population)",SH.STA.BASS.UR.ZS
People using safely managed drinking water services (% of population),SH.H2O.SMDW.ZS
"People using safely managed drinking water services, rural (% of rural population)",SH.H2O.SMDW.RU.ZS
"People using safely managed drinking water services, urban (% of urban population)",SH.H2O.SMDW.UR.ZS
People using safely managed sanitation services (% of population),SH.STA.SMSS.ZS
"People using safely managed sanitation services, rural (% of rural population)",SH.STA.SMSS.RU.ZS
"People using safely managed sanitation services, urban (% of urban population)",SH.STA.SMSS.UR.ZS
People with basic handwashing facilities including soap and water (% of population),SH.STA.HYGN.ZS
"People with basic handwashing facilities including soap and water, rural (% of rural population)",SH.STA.HYGN.RU.ZS
"People with basic handwashing facilities including soap and water, urban (% of urban population)",SH.STA.HYGN.UR.ZS
Periodicity and timeliness assessment of statistical capacity (scale 0 - 100),IQ.SCI.PRDC
Permanent cropland (% of land area),AG.LND.CROP.ZS
"Persistence to grade 5, female (% of cohort)",SE.PRM.PRS5.FE.ZS
"Persistence to grade 5, male (% of cohort)",SE.PRM.PRS5.MA.ZS
"Persistence to grade 5, total (% of cohort)",SE.PRM.PRS5.ZS
"Persistence to last grade of primary, female (% of cohort)",SE.PRM.PRSL.FE.ZS
"Persistence to last grade of primary, male (% of cohort)",SE.PRM.PRSL.MA.ZS
"Persistence to last grade of primary, total (% of cohort)",SE.PRM.PRSL.ZS
"Personal remittances, paid (current US$)",BM.TRF.PWKR.CD.DT
"Personal remittances, received (% of GDP)",BX.TRF.PWKR.DT.GD.ZS
"Personal remittances, received (current US$)",BX.TRF.PWKR.CD.DT
"Personal transfers, receipts (BoP, current US$)",BX.TRF.PWKR.CD
PFC gas emissions (thousand metric tons of CO2 equivalent),EN.ATM.PFCG.KT.CE
"Physicians (per 1,000 people)",SH.MED.PHYS.ZS
"Plant species (higher), threatened",EN.HPT.THRD.NO
"PM2.5 air pollution, mean annual exposure (micrograms per cubic meter)",EN.ATM.PM25.MC.M3
"PM2.5 air pollution, population exposed to levels exceeding WHO guideline value (% of total)",EN.ATM.PM25.MC.ZS
"PM2.5 pollution, population exposed to levels exceeding WHO Interim Target-1 value (% of total)",EN.ATM.PM25.MC.T1.ZS
"PM2.5 pollution, population exposed to levels exceeding WHO Interim Target-2 value (% of total)",EN.ATM.PM25.MC.T2.ZS
"PM2.5 pollution, population exposed to levels exceeding WHO Interim Target-3 value (% of total)",EN.ATM.PM25.MC.T3.ZS
"PNG, bonds (AMT, current US$)",DT.AMT.PNGB.CD
"PNG, bonds (DIS, current US$)",DT.DIS.PNGB.CD
"PNG, bonds (DOD, current US$)",DT.DOD.PNGB.CD
"PNG, bonds (INT, current US$)",DT.INT.PNGB.CD
"PNG, bonds (NFL, current US$)",DT.NFL.PNGB.CD
"PNG, bonds (NTR, current US$)",DT.NTR.PNGB.CD
"PNG, bonds (TDS, current US$)",DT.TDS.PNGB.CD
"PNG, commercial banks and other creditors (AMT, current US$)",DT.AMT.PNGC.CD
"PNG, commercial banks and other creditors (DIS, current US$)",DT.DIS.PNGC.CD
"PNG, commercial banks and other creditors (DOD, current US$)",DT.DOD.PNGC.CD
"PNG, commercial banks and other creditors (INT, current US$)",DT.INT.PNGC.CD
"PNG, commercial banks and other creditors (NFL, current US$)",DT.NFL.PNGC.CD
"PNG, commercial banks and other creditors (NTR, current US$)",DT.NTR.PNGC.CD
"PNG, commercial banks and other creditors (TDS, current US$)",DT.TDS.PNGC.CD
Population ages 0-14 (% of total),SP.POP.0014.TO.ZS
"Population ages 0-14, female",SP.POP.0014.FE.IN
"Population ages 0-14, female (% of total)",SP.POP.0014.FE.ZS
"Population ages 0-14, male",SP.POP.0014.MA.IN
"Population ages 0-14, male (% of total)",SP.POP.0014.MA.ZS
"Population ages 0-14, total",SP.POP.0014.TO
"Population ages 0-4, female (% of female population)",SP.POP.0004.FE.5Y
"Population ages 0-4, male (% of male population)",SP.POP.0004.MA.5Y
"Population ages 10-14, female (% of female population)",SP.POP.1014.FE.5Y
"Population ages 10-14, male (% of male population)",SP.POP.1014.MA.5Y
"Population ages 15-19, female (% of female population)",SP.POP.1519.FE.5Y
"Population ages 15-19, male (% of male population)",SP.POP.1519.MA.5Y
Population ages 15-64 (% of total),SP.POP.1564.TO.ZS
"Population ages 15-64, female",SP.POP.1564.FE.IN
"Population ages 15-64, female (% of total)",SP.POP.1564.FE.ZS
"Population ages 15-64, male",SP.POP.1564.MA.IN
"Population ages 15-64, male (% of total)",SP.POP.1564.MA.ZS
"Population ages 15-64, total",SP.POP.1564.TO
"Population ages 20-24, female (% of female population)",SP.POP.2024.FE.5Y
"Population ages 20-24, male (% of male population)",SP.POP.2024.MA.5Y
"Population ages 25-29, female (% of female population)",SP.POP.2529.FE.5Y
"Population ages 25-29, male (% of male population)",SP.POP.2529.MA.5Y
"Population ages 30-34, female (% of female population)",SP.POP.3034.FE.5Y
"Population ages 30-34, male (% of male population)",SP.POP.3034.MA.5Y
"Population ages 35-39, female (% of female population)",SP.POP.3539.FE.5Y
"Population ages 35-39, male (% of male population)",SP.POP.3539.MA.5Y
"Population ages 40-44, female (% of female population)",SP.POP.4044.FE.5Y
"Population ages 40-44, male (% of male population)",SP.POP.4044.MA.5Y
"Population ages 45-49, female (% of female population)",SP.POP.4549.FE.5Y
"Population ages 45-49, male (% of male population)",SP.POP.4549.MA.5Y
"Population ages 50-54, female (% of female population)",SP.POP.5054.FE.5Y
"Population ages 50-54, male (% of male population)",SP.POP.5054.MA.5Y
"Population ages 55-59, female (% of female population)",SP.POP.5559.FE.5Y
"Population ages 55-59, male (% of male population)",SP.POP.5559.MA.5Y
"Population ages 5-9, female (% of female population)",SP.POP.0509.FE.5Y
"Population ages 5-9, male (% of male population)",SP.POP.0509.MA.5Y
"Population ages 60-64, female (% of female population)",SP.POP.6064.FE.5Y
"Population ages 60-64, male (% of male population)",SP.POP.6064.MA.5Y
Population ages 65 and above (% of total),SP.POP.65UP.TO.ZS
"Population ages 65 and above, female",SP.POP.65UP.FE.IN
"Population ages 65 and above, female (% of total)",SP.POP.65UP.FE.ZS
"Population ages 65 and above, male",SP.POP.65UP.MA.IN
"Population ages 65 and above, male (% of total)",SP.POP.65UP.MA.ZS
"Population ages 65 and above, total",SP.POP.65UP.TO
"Population ages 65-69, female (% of female population)",SP.POP.6569.FE.5Y
"Population ages 65-69, male (% of male population)",SP.POP.6569.MA.5Y
"Population ages 70-74, female (% of female population)",SP.POP.7074.FE.5Y
"Population ages 70-74, male (% of male population)",SP.POP.7074.MA.5Y
"Population ages 75-79, female (% of female population)",SP.POP.7579.FE.5Y
"Population ages 75-79, male (% of male population)",SP.POP.7579.MA.5Y
"Population ages 80 and above, female (% of female population)",SP.POP.80UP.FE.5Y
"Population ages 80 and above, male (% of male population)",SP.POP.80UP.MA.5Y
Population density (people per sq. km of land area),EN.POP.DNST
Population growth (annual %),SP.POP.GROW
Population in largest city,EN.URB.LCTY
Population in the largest city (% of urban population),EN.URB.LCTY.UR.ZS
Population in urban agglomerations of more than 1 million,EN.URB.MCTY
Population in urban agglomerations of more than 1 million (% of total population),EN.URB.MCTY.TL.ZS
Population living in areas where elevation is below 5 meters (% of total population),EN.POP.EL5M.ZS
Population living in slums (% of urban population),EN.POP.SLUM.UR.ZS
"Population, female",SP.POP.TOTL.FE.IN
"Population, female (% of total)",SP.POP.TOTL.FE.ZS
"Population, male",SP.POP.TOTL.MA.IN
"Population, male (% of total)",SP.POP.TOTL.MA.ZS
"Population, total",SP.POP.TOTL
"Portfolio equity, net inflows (BoP, current US$)",BX.PEF.TOTL.CD.WD
"Portfolio investment, bonds (PPG + PNG) (NFL, current US$)",DT.NFL.BOND.CD
"Portfolio investment, net (BoP, current US$)",BN.KLT.PTXL.CD
Poverty gap at $1.90 a day (2011 PPP) (%),SI.POV.GAPS
Poverty gap at $3.20 a day (2011 PPP) (%),SI.POV.LMIC.GP
Poverty gap at $5.50 a day (2011 PPP) (%),SI.POV.UMIC.GP
Poverty gap at national poverty lines (%),SI.POV.NAGP
Poverty headcount ratio at $1.90 a day (2011 PPP) (% of population),SI.POV.DDAY
Poverty headcount ratio at $3.20 a day (2011 PPP) (% of population),SI.POV.LMIC
Poverty headcount ratio at $5.50 a day (2011 PPP) (% of population),SI.POV.UMIC
Poverty headcount ratio at national poverty lines (% of population),SI.POV.NAHC
Power outages in firms in a typical month (number),IC.ELC.OUTG
"PPG, bilateral (AMT, current US$)",DT.AMT.BLAT.CD
"PPG, bilateral (DIS, current US$)",DT.DIS.BLAT.CD
"PPG, bilateral (DOD, current US$)",DT.DOD.BLAT.CD
"PPG, bilateral (INT, current US$)",DT.INT.BLAT.CD
"PPG, bilateral (NTR, current US$)",DT.NTR.BLAT.CD
"PPG, bilateral (TDS, current US$)",DT.TDS.BLAT.CD
"PPG, bilateral concessional (AMT, current US$)",DT.AMT.BLTC.CD
"PPG, bilateral concessional (DIS, current US$)",DT.DIS.BLTC.CD
"PPG, bilateral concessional (DOD, current US$)",DT.DOD.BLTC.CD
"PPG, bilateral concessional (INT, current US$)",DT.INT.BLTC.CD
"PPG, bilateral concessional (NFL, current US$)",DT.NFL.BLTC.CD
"PPG, bilateral concessional (NTR, current US$)",DT.NTR.BLTC.CD
"PPG, bilateral concessional (TDS, current US$)",DT.TDS.BLTC.CD
"PPG, bonds (AMT, current US$)",DT.AMT.PBND.CD
"PPG, bonds (DIS, current US$)",DT.DIS.PBND.CD
"PPG, bonds (DOD, current US$)",DT.DOD.PBND.CD
"PPG, bonds (INT, current US$)",DT.INT.PBND.CD
"PPG, bonds (NFL, current US$)",DT.NFL.PBND.CD
"PPG, bonds (NTR, current US$)",DT.NTR.PBND.CD
"PPG, bonds (TDS, current US$)",DT.TDS.PBND.CD
"PPG, commercial banks (AMT, current US$)",DT.AMT.PCBK.CD
"PPG, commercial banks (DIS, current US$)",DT.DIS.PCBK.CD
"PPG, commercial banks (DOD, current US$)",DT.DOD.PCBK.CD
"PPG, commercial banks (INT, current US$)",DT.INT.PCBK.CD
"PPG, commercial banks (NFL, current US$)",DT.NFL.PCBK.CD
"PPG, commercial banks (NTR, current US$)",DT.NTR.PCBK.CD
"PPG, commercial banks (TDS, current US$)",DT.TDS.PCBK.CD
"PPG, IBRD (AMT, current US$)",DT.AMT.MIBR.CD
"PPG, IBRD (DIS, current US$)",DT.DIS.MIBR.CD
"PPG, IBRD (DOD, current US$)",DT.DOD.MIBR.CD
"PPG, IBRD (INT, current US$)",DT.INT.MIBR.CD
"PPG, IBRD (NTR, current US$)",DT.NTR.MIBR.CD
"PPG, IBRD (TDS, current US$)",DT.TDS.MIBR.CD
"PPG, IDA (AMT, current US$)",DT.AMT.MIDA.CD
"PPG, IDA (DIS, current US$)",DT.DIS.MIDA.CD
"PPG, IDA (DOD, current US$)",DT.DOD.MIDA.CD
"PPG, IDA (INT, current US$)",DT.INT.MIDA.CD
"PPG, IDA (NTR, current US$)",DT.NTR.MIDA.CD
"PPG, IDA (TDS, current US$)",DT.TDS.MIDA.CD
"PPG, multilateral (AMT, current US$)",DT.AMT.MLAT.CD
"PPG, multilateral (DIS, current US$)",DT.DIS.MLAT.CD
"PPG, multilateral (DOD, current US$)",DT.DOD.MLAT.CD
"PPG, multilateral (INT, current US$)",DT.INT.MLAT.CD
"PPG, multilateral (NTR, current US$)",DT.NTR.MLAT.CD
"PPG, multilateral concessional (AMT, current US$)",DT.AMT.MLTC.CD
"PPG, multilateral concessional (DIS, current US$)",DT.DIS.MLTC.CD
"PPG, multilateral concessional (DOD, current US$)",DT.DOD.MLTC.CD
"PPG, multilateral concessional (INT, current US$)",DT.INT.MLTC.CD
"PPG, multilateral concessional (NFL, current US$)",DT.NFL.MLTC.CD
"PPG, multilateral concessional (NTR, current US$)",DT.NTR.MLTC.CD
"PPG, multilateral concessional (TDS, current US$)",DT.TDS.MLTC.CD
"PPG, official creditors (AMT, current US$)",DT.AMT.OFFT.CD
"PPG, official creditors (DIS, current US$)",DT.DIS.OFFT.CD
"PPG, official creditors (DOD, current US$)",DT.DOD.OFFT.CD
"PPG, official creditors (INT, current US$)",DT.INT.OFFT.CD
"PPG, official creditors (NFL, current US$)",DT.NFL.OFFT.CD
"PPG, official creditors (NTR, current US$)",DT.NTR.OFFT.CD
"PPG, official creditors (TDS, current US$)",DT.TDS.OFFT.CD
"PPG, other private creditors (AMT, current US$)",DT.AMT.PROP.CD
"PPG, other private creditors (DIS, current US$)",DT.DIS.PROP.CD
"PPG, other private creditors (DOD, current US$)",DT.DOD.PROP.CD
"PPG, other private creditors (INT, current US$)",DT.INT.PROP.CD
"PPG, other private creditors (NFL, current US$)",DT.NFL.PROP.CD
"PPG, other private creditors (NTR, current US$)",DT.NTR.PROP.CD
"PPG, other private creditors (TDS, current US$)",DT.TDS.PROP.CD
"PPG, private creditors (AMT, current US$)",DT.AMT.PRVT.CD
"PPG, private creditors (DIS, current US$)",DT.DIS.PRVT.CD
"PPG, private creditors (DOD, current US$)",DT.DOD.PRVT.CD
"PPG, private creditors (INT, current US$)",DT.INT.PRVT.CD
"PPG, private creditors (NFL, current US$)",DT.NFL.PRVT.CD
"PPG, private creditors (NTR, current US$)",DT.NTR.PRVT.CD
"PPG, private creditors (TDS, current US$)",DT.TDS.PRVT.CD
"PPP conversion factor, GDP (LCU per international $)",PA.NUS.PPP
"PPP conversion factor, private consumption (LCU per international $)",PA.NUS.PRVT.PP
Pregnant women receiving prenatal care (%),SH.STA.ANVC.ZS
"Preprimary education, duration (years)",SE.PRE.DURS
"Presence of peace keepers (number of troops, police, and military observers in mandate)",VC.PKP.TOTL.UN
"Present value of external debt (% of exports of goods, services and primary income)",DT.DOD.PVLX.EX.ZS
Present value of external debt (% of GNI),DT.DOD.PVLX.GN.ZS
Present value of external debt (current US$),DT.DOD.PVLX.CD
Prevalence of anemia among children (% of children under 5),SH.ANM.CHLD.ZS
Prevalence of anemia among non-pregnant women (% of women ages 15-49),SH.ANM.NPRG.ZS
Prevalence of anemia among pregnant women (%),SH.PRG.ANEM
Prevalence of anemia among women of reproductive age (% of women ages 15-49),SH.ANM.ALLW.ZS
"Prevalence of HIV, female (% ages 15-24)",SH.HIV.1524.FE.ZS
"Prevalence of HIV, male (% ages 15-24)",SH.HIV.1524.MA.ZS
"Prevalence of HIV, total (% of population ages 15-49)",SH.DYN.AIDS.ZS
"Prevalence of overweight, weight for height (% of children under 5)",SH.STA.OWGH.ZS
"Prevalence of overweight, weight for height, female (% of children under 5)",SH.STA.OWGH.FE.ZS
"Prevalence of overweight, weight for height, male (% of children under 5)",SH.STA.OWGH.MA.ZS
"Prevalence of severe wasting, weight for height (% of children under 5)",SH.SVR.WAST.ZS
"Prevalence of severe wasting, weight for height, female (% of children under 5)",SH.SVR.WAST.FE.ZS
"Prevalence of severe wasting, weight for height, male (% of children under 5)",SH.SVR.WAST.MA.ZS
"Prevalence of stunting, height for age (% of children under 5)",SH.STA.STNT.ZS
"Prevalence of stunting, height for age, female (% of children under 5)",SH.STA.STNT.FE.ZS
"Prevalence of stunting, height for age, male (% of children under 5)",SH.STA.STNT.MA.ZS
Prevalence of undernourishment (% of population),SN.ITK.DEFC.ZS
"Prevalence of underweight, weight for age (% of children under 5)",SH.STA.MALN.ZS
"Prevalence of underweight, weight for age, female (% of children under 5)",SH.STA.MALN.FE.ZS
"Prevalence of underweight, weight for age, male (% of children under 5)",SH.STA.MALN.MA.ZS
"Prevalence of wasting, weight for height (% of children under 5)",SH.STA.WAST.ZS
"Prevalence of wasting, weight for height, female (% of children under 5)",SH.STA.WAST.FE.ZS
"Prevalence of wasting, weight for height, male (% of children under 5)",SH.STA.WAST.MA.ZS
Price level ratio of PPP conversion factor (GDP) to market exchange rate,PA.NUS.PPPC.RF
"Primary completion rate, female (% of relevant age group)",SE.PRM.CMPT.FE.ZS
"Primary completion rate, male (% of relevant age group)",SE.PRM.CMPT.MA.ZS
"Primary completion rate, total (% of relevant age group)",SE.PRM.CMPT.ZS
"Primary education, duration (years)",SE.PRM.DURS
"Primary education, pupils",SE.PRM.ENRL
"Primary education, pupils (% female)",SE.PRM.ENRL.FE.ZS
"Primary education, teachers",SE.PRM.TCHR
"Primary education, teachers (% female)",SE.PRM.TCHR.FE.ZS
Primary government expenditures as a proportion of original approved budget (%),GF.XPD.BUDG.ZS
"Primary income on FDI, payments (current US$)",BX.KLT.DREM.CD.DT
"Primary income payments (BoP, current US$)",BM.GSR.FCTY.CD
"Primary income receipts (BoP, current US$)",BX.GSR.FCTY.CD
Primary school starting age (years),SE.PRM.AGES
"Principal arrears, long-term DOD (US$)",DT.AXA.DPPG.CD
"Principal arrears, official creditors (current US$)",DT.AXA.OFFT.CD
"Principal arrears, private creditors (current US$)",DT.AXA.PRVT.CD
Principal forgiven (current US$),DT.AXF.DPPG.CD
"Principal repayments on external debt, long-term (AMT, current US$)",DT.AMT.DLXF.CD
"Principal repayments on external debt, long-term + IMF (AMT, current US$)",DT.AMT.DLTF.CD
"Principal repayments on external debt, private nonguaranteed (PNG) (AMT, current US$)",DT.AMT.DPNG.CD
"Principal repayments on external debt, public and publicly guaranteed (PPG) (AMT, current US$)",DT.AMT.DPPG.CD
Principal rescheduled (current US$),DT.AXR.DPPG.CD
"Principal rescheduled, official (current US$)",DT.AXR.OFFT.CD
"Principal rescheduled, private (current US$)",DT.AXR.PRVT.CD
Private credit bureau coverage (% of adults),IC.CRD.PRVT.ZS
"Probability of dying at age 5-14 years (per 1,000 children age 5)",SH.DYN.0514
Procedures to build a warehouse (number),IC.WRH.PROC
Procedures to register property (number),IC.PRP.PROC
Profit tax (% of commercial profits),IC.TAX.PRFT.CP.ZS
Progression to secondary school (%),SE.SEC.PROG.ZS
"Progression to secondary school, female (%)",SE.SEC.PROG.FE.ZS
"Progression to secondary school, male (%)",SE.SEC.PROG.MA.ZS
Proportion of population pushed below the $1.90 ($ 2011 PPP) poverty line by out-of-pocket health care expenditure (%),SH.UHC.NOP1.ZS
Proportion of population pushed below the $3.10 ($ 2011 PPP) poverty line by out-of-pocket health care expenditure (%),SH.UHC.NOP2.ZS
Proportion of population spending more than 10% of household consumption or income on out-of-pocket health care expenditure (%),SH.UHC.OOPC.10.ZS
Proportion of population spending more than 25% of household consumption or income on out-of-pocket health care expenditure (%),SH.UHC.OOPC.25.ZS
Proportion of seats held by women in national parliaments (%),SG.GEN.PARL.ZS
"Proportion of time spent on unpaid domestic and care work, female (% of 24 hour day)",SG.TIM.UWRK.FE
"Proportion of time spent on unpaid domestic and care work, male (% of 24 hour day)",SG.TIM.UWRK.MA
Proportion of women subjected to physical and/or sexual violence in the last 12 months (% of women age 15-49),SG.VAW.1549.ZS
"Public and publicly guaranteed debt service (% of exports of goods, services and primary income)",DT.TDS.DPPG.XP.ZS
Public and publicly guaranteed debt service (% of GNI),DT.TDS.DPPG.GN.ZS
Public credit registry coverage (% of adults),IC.CRD.PUBL.ZS
Public private partnerships investment in energy (current US$),IE.PPN.ENGY.CD
Public private partnerships investment in ICT (current US$),IE.PPN.ICTI.CD
Public private partnerships investment in transport (current US$),IE.PPN.TRAN.CD
Public private partnerships investment in water and sanitation (current US$),IE.PPN.WATR.CD
Pump price for diesel fuel (US$ per liter),EP.PMP.DESL.CD
Pump price for gasoline (US$ per liter),EP.PMP.SGAS.CD
"Pupil-teacher ratio, lower secondary",SE.SEC.ENRL.LO.TC.ZS
"Pupil-teacher ratio, preprimary",SE.PRE.ENRL.TC.ZS
"Pupil-teacher ratio, primary",SE.PRM.ENRL.TC.ZS
"Pupil-teacher ratio, secondary",SE.SEC.ENRL.TC.ZS
"Pupil-teacher ratio, tertiary",SE.TER.ENRL.TC.ZS
"Pupil-teacher ratio, upper secondary",SE.SEC.ENRL.UP.TC.ZS
"Quality of port infrastructure, WEF (1=extremely underdeveloped to 7=well developed and efficient by international standards)",IQ.WEF.PORT.XQ
Rail lines (total route-km),IS.RRS.TOTL.KM
"Railways, goods transported (million ton-km)",IS.RRS.GOOD.MT.K6
"Railways, passengers carried (million passenger-km)",IS.RRS.PASG.KM
Ratio of female to male labor force participation rate (%) (modeled ILO estimate),SL.TLF.CACT.FM.ZS
Ratio of female to male labor force participation rate (%) (national estimate),SL.TLF.CACT.FM.NE.ZS
Real effective exchange rate index (2010 = 100),PX.REX.REER
Real interest rate (%),FR.INR.RINR
Refugee population by country or territory of asylum,SM.POP.REFG
Refugee population by country or territory of origin,SM.POP.REFG.OR
Renewable electricity output (% of total electricity output),EG.ELC.RNEW.ZS
Renewable energy consumption (% of total final energy consumption),EG.FEC.RNEW.ZS
Renewable internal freshwater resources per capita (cubic meters),ER.H2O.INTR.PC
"Renewable internal freshwater resources, total (billion cubic meters)",ER.H2O.INTR.K3
"Repeaters, primary, female (% of female enrollment)",SE.PRM.REPT.FE.ZS
"Repeaters, primary, male (% of male enrollment)",SE.PRM.REPT.MA.ZS
"Repeaters, primary, total (% of total enrollment)",SE.PRM.REPT.ZS
Research and development expenditure (% of GDP),GB.XPD.RSDV.GD.ZS
Researchers in R&D (per million people),SP.POP.SCIE.RD.P6
"Reserves and related items (BoP, current US$)",BN.RES.INCL.CD
"Residual, debt stock-flow reconciliation (current US$)",DT.DOD.RSDL.CD
"Revenue, excluding grants (% of GDP)",GC.REV.XGRT.GD.ZS
"Revenue, excluding grants (current LCU)",GC.REV.XGRT.CN
Risk of catastrophic expenditure for surgical care (% of people at risk),SH.SGR.CRSK.ZS
Risk of impoverishing expenditure for surgical care (% of people at risk),SH.SGR.IRSK.ZS
"Risk premium on lending (lending rate minus treasury bill rate, %)",FR.INR.RISK
Rural land area (sq. km),AG.LND.TOTL.RU.K2
Rural land area where elevation is below 5 meters (% of total land area),AG.LND.EL5M.RU.ZS
Rural land area where elevation is below 5 meters (sq. km),AG.LND.EL5M.RU.K2
Rural population,SP.RUR.TOTL
Rural population (% of total population),SP.RUR.TOTL.ZS
Rural population growth (annual %),SP.RUR.TOTL.ZG
Rural population living in areas where elevation is below 5 meters (% of total population),EN.POP.EL5M.RU.ZS
Rural poverty gap at national poverty lines (%),SI.POV.RUGP
